Question,Answer
What does being 'Registered with the Federation of Holistic Therapists (FHT)' specifically mean for clients regarding the quality of service?,"Being registered with the Federation of Holistic Therapists (FHT) signifies that The Sunday Therapist adheres to the high standards set by this professional body. This ensures that Joanne, the therapist, has met rigorous requirements in both her training and ongoing practice, providing clients with assurance of professional, ethical, and high-quality care."
"Are all products used in treatments, especially facials and massages, guaranteed to be vegan and cruelty-free?","Yes, The Sunday Therapist has a clear commitment to using only vegan and cruelty-free products across all its complementary therapies. This applies to all treatments, including facials and massages."
"How are therapies tailored to individual needs, and what is the process for determining the best approach for a client?","The Sunday Therapist offers 'tailored therapies for individual needs.' While the specific process isn't detailed, it implies a personalized consultation where Joanne assesses the client's unique concerns, goals, and overall well-being to recommend and adapt treatments for the most effective and rejuvenating experience."
What are the primary benefits a client can expect from a Wood Massage treatment?,"The Wood Massage treatment is globally popular for its ability to sculpt and tone the body. Beyond aesthetic benefits, it also contributes to boosting overall wellness."
Can you explain the specific conditions that Myofascial Release is designed to address?,"Myofascial Release is a specialized treatment that involves gentle, sustained pressure. It focuses on addressing soft tissue dysfunction, alleviating pain, and releasing tension within the body."
What is the key difference between the 'Holistic Facial' and the 'Luxury Holistic Facial'?,"The 'Holistic Facial' treatment includes a double cleanse, exfoliate, steam, facial massage, mask, tone and moisturise using natural skincare products for £27. The 'Luxury Holistic Facial' is priced at £45 and is described as a 'Luxury facial treatment for radiant youthful skin,' suggesting a more extensive or premium experience to achieve enhanced results."
Which specific 30-minute treatments are eligible for the 'Mix and Match' offer?,"The 'Mix and Match' offer allows you to combine any two of the following 30-minute treatments for £45: Myofascial Release (30 mins), Back, Neck & Shoulder (BNS) Massage (30 mins), Head Massage, Holistic Facial, Hopi Ear Candling, and Reflexology (30 mins)."
"How can I book an appointment, and is there an online booking system or should I call/email?","The website provides contact details for booking. You can get in touch by calling 07763 452 823, emailing thesundaytherapist@outlook.com, or reaching out via their Facebook page @therapyonsunday. An online booking system is not explicitly mentioned, so calling or emailing would be the primary methods."
"What denominations are available for gift vouchers, or can they be purchased for a specific treatment?","The Sunday Therapist offers gift vouchers as a 'perfect gift for a loved one.' While specific denominations aren't listed, it's highly plausible that they can be purchased for a specific treatment from the price list or for a monetary value that can be redeemed towards any service."
How does the Menopause Massage specifically target symptoms associated with menstruation and menopause?,"The Menopause Massage is a variation of Swedish massage that incorporates acupressure techniques. It specifically targets symptoms associated with menstruation and menopause, implying that the acupressure points and massage strokes are chosen to alleviate discomfort, hormonal imbalances, and other related issues experienced during these phases."
What are the unique benefits of the Red Light Therapy Facial Massage compared to other facial treatments offered?,"The Red Light Therapy Facial Massage is priced as the most premium facial treatment (£60) and is described as a 'Luxury facial treatment for radiant youthful skin.' While specific details of the red light therapy aren't provided, it's commonly known to stimulate collagen, reduce inflammation, and improve skin tone, suggesting it offers advanced anti-aging and skin rejuvenation benefits beyond a standard or luxury holistic facial."
"Beyond alleviating headaches and sinus congestion, what other wellness benefits does Hopi Ear Candling provide?","In addition to alleviating headaches and improving sinus congestion, Hopi Ear Candling is also known to help improve tinnitus, soften ear wax, and promote overall wellness."
Could you explain the underlying theory behind Reflexology as practiced at The Sunday Therapist?,"Reflexology at The Sunday Therapist is based on the theory that the organs and structures of the body are interconnected and mapped to specific points on the feet. By applying gentle pressure to these reflex points, the treatment aims to stimulate corresponding areas in the body, promoting healing and overall well-being."
"What are the specific benefits of Manual Lymphatic Drainage, particularly in terms of detoxification and water retention?","Manual Lymphatic Drainage offers several benefits, including boosting the immune system, reducing water retention, and enhancing the body's natural detoxification processes."
I noticed a prompt about consent for website translations. Where can I find the privacy policy related to this third-party service?,"The website states, 'Please review the details in the privacy policy and accept the service to view the translations.' This indicates that the full privacy policy, including details about the third-party translation service and its data collection, is available on the website, likely linked from the consent prompt itself."
"What kind of data do the third-party website tracking technologies collect, and how is it used for advertising?","The website uses third-party tracking technologies to collect data about your activity. This data is used to continually improve their services and to display advertisements that are tailored 'according to users' interests.' Specific data types aren't detailed, but it implies browsing behavior and preferences."
How can I configure my privacy settings to deactivate specific trackers like IONOS SiteAnalytics on this website?,"The website provides a 'Privacy Settings' tool. You can use this tool to 'select and deactivate various tags / trackers / analytic tools used on this website,' including IONOS SiteAnalytics. There's also an option to 'Select all services' to manage consent."
What payment methods are accepted for treatments and gift voucher purchases?,"The website does not explicitly state the accepted payment methods. However, for a professional therapy service, it is highly plausible that common methods such as cash, major credit/debit cards, and potentially bank transfers would be accepted. It's best to confirm directly when booking."
Is there anything I should do to prepare for my first holistic therapy session at The Sunday Therapist?,"The website does not provide specific pre-appointment instructions. However, generally for holistic therapies, it's advisable to wear comfortable clothing, arrive a few minutes early to relax, and be prepared to discuss your health history and wellness goals with Joanne to ensure the therapy is tailored to your needs."
Are there any package deals or discounts for booking multiple sessions or follow-up appointments?,"The website explicitly mentions a 'Mix and Match' offer where you can combine any two 30-minute treatments for £45, saving up to £15. Beyond this, no other package deals or discounts for multiple sessions are listed."
Is the location at 462a Walmersley Road easily accessible by public transport or does it have parking facilities?,"The website provides the address: 462a Walmersley Road, Bury, BL9 6QP. While it doesn't explicitly state public transport access or parking, Walmersley Road is a main road in Bury, suggesting it would likely be accessible by local bus routes. Parking availability would need to be confirmed directly, as it's not mentioned."
"While registered with FHT, does Joanne have any other specific training or certifications in the various therapies offered?","The website states Joanne started training in holistic therapies in 2019 and is registered with the FHT, which ensures high standards in both training and practice. While specific individual certifications for each therapy aren't explicitly listed, her FHT registration implies she is qualified in the therapies she offers, and her decision to leave the NHS for this career suggests extensive dedication and training in her chosen field."
"What can a client expect to experience during a Reiki session, particularly regarding the 'channeling of universal energy'?","During a Reiki session, the therapist, Joanne, channels 'universal energy' through her hands. Clients typically experience a calming process, often feeling deeply relaxed. While the energy itself isn't physically tangible in the same way as massage, many report sensations of warmth, tingling, or profound peace, promoting healing and overall well-being."
What is the primary benefit of opting for a Manual Lymphatic Drainage treatment at The Sunday Therapist?,"Manual Lymphatic Drainage at The Sunday Therapist offers several key benefits, including boosting the immune system, reducing water retention, and enhancing the body's natural detoxification processes."
Could you explain the difference in technique or focus between a standard Swedish Massage and a Deep Tissue Massage offered by The Sunday Therapist?,"A Swedish Massage at The Sunday Therapist uses gentle, long gliding strokes primarily to relax muscles, improve circulation, and relieve general tension. In contrast, a Deep Tissue Massage employs focused techniques with firm pressure to reach and work on the deeper layers of the muscles, addressing more profound tension."
"What is the duration and cost for a Myofascial Release session, and are there different options available?","Yes, there are two options for Myofascial Release. A 30-minute session costs £30, while a longer 60-minute session is priced at £50."
"What kind of products does The Sunday Therapist use for their treatments, particularly regarding ethical considerations?","The Sunday Therapist is committed to using only vegan and cruelty-free products across all their complementary therapies, aligning with their holistic wellness approach."
I'm looking for a treatment that can help with headaches and stress. Which therapy would you recommend from The Sunday Therapist's offerings?,"For stress reduction and relief from headaches, the Head Massage treatment is highly recommended. It involves a gentle massage to the neck, face, and scalp specifically designed to alleviate these symptoms."
"What is the core philosophy or approach that Joanne, the therapist, brings to her practice at The Sunday Therapist?","Joanne's core philosophy is rooted in treating the whole person – body, mind, and spirit – to achieve holistic wellness. She believes this approach leads to benefits such as reduced stress and anxiety, enhanced immune function, pain alleviation, and overall improvement in long-term wellbeing, a belief strengthened by her 24 years of experience in the NHS."
What is the significance of The Sunday Therapist being registered with the Federation of Holistic Therapists (FHT)?,"Being registered with the Federation of Holistic Therapists (FHT) signifies that The Sunday Therapist, and Joanne, adhere to the high standards set by this professional body for both training and practice in holistic therapies, ensuring quality and professionalism."
"Can I combine different 30-minute treatments, and if so, what is the cost and potential saving?","Yes, The Sunday Therapist offers a 'Mix and Match' option where you can combine any two 30-minute treatments for a total cost of £45. This offers a saving of up to £15 compared to booking them individually."
What is the specific address for The Sunday Therapist in Bury?,"The Sunday Therapist is located at 462a Walmersley Road, Bury, BL9 6QP."
What are the benefits of the Wood Massage therapy offered?,The Wood Massage treatment at The Sunday Therapist is known for its ability to sculpt and tone the body while also boosting overall wellness.
Could you describe the process involved in the Luxury Holistic Facial?,"The Luxury Holistic Facial is a comprehensive treatment that includes a double cleanse, exfoliation, steam, a facial massage, a mask, toning, and moisturising, all performed using natural skincare products to promote radiant and youthful skin."
"What is the price for a 30-minute Back, Neck & Shoulder (BNS) Massage, and is there an option to include Myofascial Release?","A 30-minute Back, Neck & Shoulder (BNS) Massage costs £30. There is also an option for a 45-minute BNS Massage that includes Myofascial Release, priced at £40."
How does the Menopause Massage specifically address symptoms associated with menstruation and menopause?,"The Menopause Massage is a specialised treatment that combines Swedish massage techniques with acupressure, specifically targeting symptoms associated with both menstruation and menopause to provide relief and support."
What are the opening hours for The Sunday Therapist on weekends?,"On Saturdays, The Sunday Therapist is open from 9am to 7pm. On Sundays, the hours are from 10am to 5pm."
"What is the concept behind Reflexology, as offered by The Sunday Therapist?","Reflexology at The Sunday Therapist is based on the theory that the organs and structures of the body are interconnected and have corresponding 'maps' or reflex points on the feet. By applying pressure to these points, it aims to promote healing and wellbeing in the related body parts."
What is the email address to contact The Sunday Therapist?,You can contact The Sunday Therapist via email at thesundaytherapist@outlook.com.
"What year did Joanne begin her training in holistic therapies, and when did she transition to it as a full-time career?",Joanne started training in holistic therapies in 2019. She then decided to leave the NHS in 2025 after 24 years of service to focus on holistic therapies as her full-time career.
"Is there a specific facial treatment designed to promote radiant and youthful skin, and what is its cost?","Yes, the Red Light Therapy Facial Massage is a luxury facial treatment specifically designed for radiant and youthful skin, and it costs £60."
What are some of the specific issues that Hopi Ear Candling can help to alleviate?,"Hopi Ear Candling is a calming process that can help to alleviate headaches, improve tinnitus, ease sinus congestion, soften ear wax, and promote overall wellness."
"How much does a 60-minute Reflexology session cost, and is there a shorter option available?",A 60-minute Reflexology session costs £42. There is also a shorter 30-minute option available for £27.
"Beyond individual treatments, does The Sunday Therapist offer any special packages or gift options?","Yes, The Sunday Therapist offers gift vouchers, which are described as the perfect gift for a loved one. They also have a 'Mix and Match' offer for combining two 30-minute treatments."
What is the meaning of the word 'Reiki' in the context of the therapy offered?,"The word 'Reiki' means universal energy. During a session, the therapist channels this universal energy through their hands to promote healing within the client."
What is the primary focus of Myofascial Release therapy?,"Myofascial Release is a specialised treatment that involves gentle sustained pressure, primarily focusing on addressing soft tissue dysfunction, pain, and tension within the body."
What is the telephone number to get in touch with The Sunday Therapist?,You can get in touch with The Sunday Therapist by calling 07763 452 823.
I'm interested in a comprehensive foot treatment that includes Reflexology. Is there such an offering?,"Yes, The Sunday Therapist offers a 'Luxury Foot Soak, Foot Scrub, Foot Massage with 30-Minute Reflexology Treatment' for £45, providing a comprehensive and relaxing foot experience."
How does The Sunday Therapist define 'holistic wellness' and what aspects of a person does it address?,"The Sunday Therapist defines 'holistic wellness' as treating the whole person, encompassing the body, mind, and spirit. This approach aims to provide transformative therapies for overall wellbeing, leading to benefits such as reduced stress and anxiety, enhanced immune function, alleviation of pain, and overall improvement in long-term wellbeing."
What inspired Joanne to transition from a 24-year career in the NHS to focus entirely on holistic therapies?,"Joanne's passion for holistic therapies grew significantly after she started training in 2019 while working for the NHS. She witnessed firsthand the profound benefits of treating the whole person, which ultimately led her to leave the NHS in 2025 after 24 years of service to dedicate her career to this field."
What does being registered with the Federation of Holistic Therapists (FHT) mean for clients of The Sunday Therapist?,Being registered with the Federation of Holistic Therapists (FHT) assures clients that The Sunday Therapist adheres to high standards in both training and practice. The FHT is a professional body that ensures its members meet specific criteria for competence and ethical conduct in holistic therapies.
Why is it important to The Sunday Therapist to use only vegan and cruelty-free products for treatments?,"The Sunday Therapist is committed to using vegan and cruelty-free products as part of its ethical approach to holistic wellness. This commitment reflects a dedication to practices that are kind to both clients and the environment, aligning with a broader philosophy of wellbeing."
How does The Sunday Therapist ensure therapies are 'tailored for individual needs' rather than a one-size-fits-all approach?,"The Sunday Therapist emphasizes tailoring therapies to individual needs. While the specific method of tailoring isn't detailed, the commitment implies that treatments are adapted based on a client's specific concerns, conditions, and desired outcomes to provide a personalized rejuvenating experience."
"Beyond relaxation, what are some of the long-term health benefits Joanne has observed in clients receiving holistic therapy?","Beyond relaxation, Joanne has observed several long-term health benefits from holistic therapy, including reduced stress and anxiety, enhanced immune function, alleviation of pain, and an overall improvement in long-term wellbeing by treating the whole person."
Can you provide an example of two 30-minute treatments that can be combined under the 'Mix and Match' offer for £45?,"Yes, under the 'Mix and Match' offer, you can combine any two 30-minute treatments for £45. For example, you could choose a 30-minute Myofascial Release and a 30-minute Back, Neck & Shoulder (BNS) Massage, or a 30-minute Reflexology and a Head Massage."
What are the primary goals or benefits a client can expect from a Wood Massage session?,A client can expect a Wood Massage session to sculpt and tone the body while boosting overall wellness. This treatment has gained global popularity for these specific benefits.
"How does the Menopause Massage specifically target symptoms associated with menstruation and menopause, and what techniques are used?",The Menopause Massage is a specialized Swedish massage that incorporates acupressure techniques. It specifically targets symptoms associated with menstruation and menopause by applying pressure to specific points to help alleviate discomfort and promote balance during these hormonal stages.
What is the difference in focus or intensity between the 30-minute and 60-minute Myofascial Release treatments?,"While the web content doesn't explicitly detail the difference in focus or intensity, a 60-minute Myofascial Release session (£50) would typically allow for a more comprehensive and in-depth treatment compared to the 30-minute session (£30), enabling the therapist to address a wider area or focus more deeply on specific soft tissue dysfunction, pain, and tension."
"What is included in the Luxury Foot Soak, Foot Scrub, Foot Massage with 30-Minute Reflexology Treatment, and what is its price?","The Luxury Foot Soak, Foot Scrub, Foot Massage with 30-Minute Reflexology Treatment is a comprehensive foot care package. It includes a relaxing foot soak, an exfoliating foot scrub, a soothing foot massage, and a 30-minute Reflexology session. The price for this package is £45."
Could you explain the concept of 'universal energy' in the context of a Reiki session at The Sunday Therapist?,"In the context of a Reiki session at The Sunday Therapist, 'Reiki' means 'universal energy'. During a session, the therapist acts as a channel for this universal energy, directing it through their hands to the client. This process is believed to promote healing, balance, and overall wellbeing within the client's body, mind, and spirit."
What specific conditions or issues might Manual Lymphatic Drainage be particularly effective for?,"Manual Lymphatic Drainage is particularly effective for boosting the immune system, reducing water retention, and enhancing detoxification. It can be beneficial for individuals experiencing swelling, fluid retention, or those looking to support their body's natural cleansing processes."
What kind of 'natural skincare products' are used during the Luxury Holistic Facial?,"During the Luxury Holistic Facial, The Sunday Therapist uses natural skincare products. While specific brands are not mentioned, the commitment to natural products aligns with their overall holistic and ethical approach, which also includes using vegan and cruelty-free items."
What are the expected outcomes or benefits of the Red Light Therapy Facial Massage?,"The Red Light Therapy Facial Massage is described as a luxury facial treatment aimed at achieving radiant and youthful skin. It combines facial massage with the benefits of red light therapy, which is known for its rejuvenating effects on skin cells."
"Besides softening ear wax, what other issues like tinnitus or sinus congestion can Hopi Ear Candling help alleviate?","Besides softening ear wax, Hopi Ear Candling is a calming process that can help alleviate headaches, improve tinnitus, ease sinus congestion, and promote overall wellness. It's a gentle treatment for the ear, nose, and throat area."
How does the theory that organs and body structures are mapped to the feet guide the practice of Reflexology at The Sunday Therapist?,"Reflexology at The Sunday Therapist is based on the theory that the organs and structures of the body are connected and mapped to specific points on the feet. By applying pressure to these reflex points, the therapist aims to stimulate corresponding areas of the body, promoting healing, relaxation, and balance throughout the entire system."
What is the most efficient way to book an appointment with The Sunday Therapist?,"The most efficient way to book an appointment with The Sunday Therapist would likely be by calling 07763 452 823 or sending an email to thesundaytherapist@outlook.com. You can also reach out via their Facebook page, @therapyonsunday."
Are there any specific terms or conditions for redeeming a gift voucher purchased from The Sunday Therapist?,"The web content mentions that gift vouchers are available, but it does not specify any particular terms or conditions for their redemption. For detailed information, it would be best to contact The Sunday Therapist directly using the provided contact details."
"Is The Sunday Therapist located in an easily accessible area of Bury, and are there any parking facilities nearby?","The Sunday Therapist is located at 462a Walmersley Road, Bury, BL9 6QP. While the website doesn't explicitly state parking availability, Walmersley Road is a main thoroughfare, suggesting it is generally accessible. For specific information on parking, it would be advisable to contact them directly."
What distinguishes a Swedish massage from a Deep Tissue massage in terms of technique and intended effect?,"A Swedish Massage uses gentle, long gliding strokes primarily to relax muscles, improve circulation, and relieve general tension. In contrast, a Deep Tissue Massage employs focused techniques with firm pressure to reach deeper layers of the muscles, aiming to release chronic muscle tension and knots."
"What does the 'BNS Massage inc. Myofascial Release (45 mins)' entail, and how does it differ from a standard Back, Neck & Shoulder massage?","The 'BNS Massage inc. Myofascial Release (45 mins)' is a combined treatment that includes a Back, Neck & Shoulder (BNS) massage along with Myofascial Release techniques. This differs from a standard BNS massage by incorporating gentle sustained pressure focused on soft tissue dysfunction, pain, and tension, offering a more targeted approach to muscle and connective tissue issues in addition to general relaxation."
"What data might be collected by the third-party service used for website translations, and where can I review the privacy policy?","The third-party service used for website translations may collect data about your activity. To review the details regarding what data is collected, you should consult the privacy policy mentioned on the website. You need to give consent to load the translations after reviewing the policy."
