Question,Answer
Where exactly is The Sunday Therapist located?,"The Sunday Therapist is located at 462a Walmersley Road, Bury, BL9 6QP."
What are the contact details for The Sunday Therapist if I want to call or email?,You can contact The Sunday Therapist by telephone at 07763452823 or by email at thesundaytherapist@outlook.com.
Could you please tell me the operating hours for The Sunday Therapist?,"The Sunday Therapist is open Monday, Tuesday, and Saturday from 9am to 7pm, and on Sundays from 10am to 5pm."
Who is the therapist behind The Sunday Therapist and what is their professional background?,"The therapist is Joanne. She started training in holistic therapies in 2019 while working for the NHS, where she served for 24 years before deciding to leave in 2025 to focus on holistic therapies as a full-time career."
What is the core philosophy or approach of the therapies offered at The Sunday Therapist?,"The core philosophy is holistic healing, offering transformative therapies designed for holistic wellness by treating the whole person – body, mind, and spirit – to promote relaxation and rejuvenation."
Are the products used in therapies at The Sunday Therapist ethically sourced or produced?,"Yes, The Sunday Therapist is committed to using vegan and cruelty-free products in all therapies."
Is The Sunday Therapist registered with any professional regulatory body?,"Yes, The Sunday Therapist is registered with the Federation of Holistic Therapists (FHT), which is a professional body that ensures high standards in both training and practice."
"What kind of benefits can I expect from holistic therapy, according to Joanne?","According to Joanne, holistic therapy, by treating the whole person, can result in reduced stress and anxiety, enhanced immune function, alleviation of pain, and overall improvement in long-term wellbeing."
Can you describe the Swedish Massage offered?,"Swedish Massage is a gentle massage that uses long gliding strokes to relax muscles, improve circulation, and relieve tension."
What is the specific purpose of the Menopause Massage?,The Menopause Massage is a Swedish massage with acupressure specifically designed to target symptoms associated with menstruation and menopause.
What are the reported benefits of the Manual Lymphatic Drainage treatment?,"The benefits of Manual Lymphatic Drainage include boosting the immune system, reducing water retention, and enhancing detoxification."
How does Myofascial Release therapy work and what does it address?,"Myofascial Release is a specialized treatment that involves gentle sustained pressure, focusing on soft tissue dysfunction, pain, and tension."
What does a Head Massage at The Sunday Therapist involve and what are its benefits?,"A Head Massage involves gentle massage to the neck, face, and scalp. Its benefits include stress reduction and relief from headaches."
What is Reiki and how is it performed at The Sunday Therapist?,"Reiki means universal energy. During a session, the therapist channels this energy through their hands to promote healing."
What issues can Hopi Ear Candling help to alleviate?,"Hopi Ear Candling can help to alleviate headaches, improve tinnitus, ease sinus congestion, soften ear wax, and promote overall wellness."
How much does a Deep Tissue Full Body Massage cost?,A Deep Tissue Full Body Massage costs £55.
What are the different pricing options for Myofascial Release?,Myofascial Release is priced at £30 for a 30-minute session and £50 for a 60-minute session.
What is the price for a Luxury Holistic Facial compared to a standard Holistic Facial?,"A standard Holistic Facial costs £27, while a Luxury Holistic Facial costs £45."
Is there a special offer for combining multiple shorter treatments?,"Yes, The Sunday Therapist offers a 'Mix and Match' option where you can combine any two 30-minute treatments for £45, which can result in a saving of up to £15."
Are gift vouchers available for purchase?,"Yes, gift vouchers are available and can be purchased as a gift for a loved one."
What is the cost of a Red Light Therapy Facial Massage?,The Red Light Therapy Facial Massage costs £60.
What is the underlying theory or concept behind Reflexology?,Reflexology is based on the theory that the organs and structures of the body are connected and mapped to the feet.
When did Joanne first begin her training in holistic therapies?,Joanne started training in holistic therapies in 2019.
Why does the website ask for my consent to load translations?,"The website uses a third-party service to translate content, which may collect data about your activity. Consent is requested to view translations after reviewing the privacy policy."
What kind of website tracking or analytics tools are mentioned on The Sunday Therapist's site?,"The site mentions using third-party website tracking technologies for services and advertisements, and specifically names 'Website Translator' and 'IONOS SiteAnalytics' as tools that can be managed in privacy settings."
Why did Joanne decide to leave the NHS to pursue holistic therapy as a full-time career?,"Joanne's passion for holistic therapies grew significantly after starting her training in 2019 while working for the NHS. She decided to leave the NHS in 2025, after 24 years of service, to focus on holistic therapy as her primary career, having seen first-hand its benefits."
What specific benefits does The Sunday Therapist highlight for individuals receiving holistic therapy?,"The Sunday Therapist highlights several benefits of holistic therapy, including reduced stress and anxiety, enhanced immune function, alleviation of pain, and an overall improvement in long-term wellbeing by treating the whole person – body, mind, and spirit."
What does being registered with the Federation of Holistic Therapists (FHT) signify for clients of The Sunday Therapist?,"Being registered with the Federation of Holistic Therapists (FHT) signifies that The Sunday Therapist, and specifically Joanne, adheres to high standards in both training and practice, as the FHT is a professional body that ensures these standards."
What kind of products does The Sunday Therapist commit to using during treatments?,The Sunday Therapist is committed to using vegan and cruelty-free products for all treatments.
How does the Menopause Massage specifically address symptoms associated with menstruation and menopause?,The Menopause Massage is a specialized Swedish massage that incorporates acupressure specifically targeting symptoms associated with menstruation and menopause.
What are the primary benefits of the Wood Massage therapy offered?,The Wood Massage therapy is globally popular for its ability to sculpt and tone the body while also boosting overall wellness.
What health improvements can clients expect from a Manual Lymphatic Drainage session?,"Clients can expect benefits such as a boosted immune system, reduced water retention, and enhanced detoxification from a Manual Lymphatic Drainage session."
What is the specific focus of the Myofascial Release treatment?,"Myofascial Release is a specialized treatment that involves gentle sustained pressure, focusing on addressing soft tissue dysfunction, pain, and tension."
"Besides stress reduction, what other benefits does the Head Massage provide?","In addition to stress reduction, the Head Massage treatment can provide relief from headaches."
What does the Luxury Holistic Facial treatment typically include?,"The Luxury Holistic Facial treatment includes a double cleanse, exfoliation, steam, facial massage, mask, tone, and moisturize, all using natural skincare products."
What is the main goal or benefit of the Red Light Therapy Facial Massage?,The main goal or benefit of the Red Light Therapy Facial Massage is to achieve radiant and youthful skin.
How does Reiki therapy work at The Sunday Therapist?,"During a Reiki session, the therapist channels 'universal energy' (as 'Reiki' means universal energy) through their hands to promote healing in the client."
What range of issues can Hopi Ear Candling help to alleviate?,"Hopi Ear Candling is a calming process that can help to alleviate headaches, improve tinnitus, ease sinus congestion, soften ear wax, and promote overall wellness."
What is the underlying theory behind Reflexology as practiced at The Sunday Therapist?,Reflexology is based on the theory that the organs and structures of the body are connected and mapped to specific points on the feet.
Can you explain the 'Mix and Match' offer and how much a client can save?,"The 'Mix and Match' offer allows clients to choose any two 30-minute treatments for a combined price of £45, which can result in a saving of up to £15."
For what occasion might someone consider purchasing a gift voucher from The Sunday Therapist?,"A gift voucher from The Sunday Therapist is suggested as a perfect gift for a loved one, implying it's suitable for spoiling someone on any special occasion."
"When did Joanne start training in holistic therapies, and when did she transition to it as a full-time career?",Joanne started training in holistic therapies in 2019 and decided to leave the NHS to focus on it as a full-time career in 2025.
How does The Sunday Therapist define 'holistic healing' or 'treating the whole person'?,"The Sunday Therapist defines holistic healing as transformative therapies designed for holistic wellness, emphasizing treating the whole person, encompassing the body, mind, and spirit."
How does The Sunday Therapist ensure therapies are tailored to individual needs?,"The Sunday Therapist is committed to providing tailored therapies designed for individual needs, ensuring a rejuvenating experience specific to each client."
What is the key difference in technique and pressure between Swedish Massage and Deep Tissue Massage?,"Swedish Massage uses gentle, long gliding strokes to relax muscles and improve circulation, while Deep Tissue Massage harnesses focused techniques with firm pressure to reach the deeper layers of the muscles."
How much does a 30-minute Myofascial Release session cost?,A 30-minute Myofascial Release session costs £30.
What is the price for a 60-minute Reflexology treatment?,A 60-minute Reflexology treatment is priced at £42.
"Is there a specialized foot treatment available that combines multiple services, and what does it include?","Yes, there is a specialized Luxury Foot Soak, Foot Scrub, Foot Massage with 30-Minute Reflexology Treatment available for £45."
"Why does the website require user consent to load translations, and what data might be collected?","The website requires consent to load translations because it uses a third-party service for this purpose, which may collect data about user activity. Users are advised to review the privacy policy for details."
"What third-party tracking technologies does The Sunday Therapist's website use, and what is their purpose?","The Sunday Therapist's website uses third-party tracking technologies, specifically 'Website Translator' and 'IONOS SiteAnalytics'. These are used to provide and continually improve services, and to display advertisements according to users' interests."
What does 'holistic wellness' mean in the context of The Sunday Therapist's offerings?,"Holistic wellness at The Sunday Therapist involves transformative therapies designed to treat the whole person – body, mind, and spirit. This approach aims to provide benefits such as reduced stress and anxiety, enhanced immune function, alleviation of pain, and overall improvement in long-term wellbeing."
Can you tell me about Joanne's background and her transition to becoming The Sunday Therapist?,"Joanne started training in holistic therapies in 2019 while working for the NHS. After 24 years of service with the NHS, her passion for holistic therapies grew to the point where she decided to leave in 2025 to focus on this as her full-time career. She has seen firsthand the benefits of treating the whole person."
How does being registered with the Federation of Holistic Therapists (FHT) assure clients of high standards?,"The Federation of Holistic Therapists (FHT) is a professional body that ensures high standards in both the training and practice of its registered therapists. This registration signifies Joanne's commitment to maintaining professional excellence and adhering to industry best practices, providing clients with confidence in her qualifications and services."
What specific benefits can I expect from a holistic therapy approach at The Sunday Therapist?,"A holistic therapy approach at The Sunday Therapist, by treating the whole person (body, mind, and spirit), can lead to several benefits including reduced stress and anxiety, enhanced immune function, alleviation of pain, and an overall improvement in long-term wellbeing."
Could you describe the Menopause Massage treatment and what symptoms it aims to address?,"The Menopause Massage is a specialized treatment that combines Swedish massage techniques with acupressure. It specifically targets symptoms associated with both menstruation and menopause, providing relief and support during these periods."
"What is Wood Massage, and what are its primary benefits for the body?","Wood Massage is a treatment that has gained global popularity for its ability to sculpt and tone the body. Beyond aesthetic benefits, it also boosts overall wellness."
"What is Manual Lymphatic Drainage, and what are its intended benefits?","Manual Lymphatic Drainage is a specialized treatment designed to boost the immune system, reduce water retention, and enhance detoxification processes within the body."
Can you explain what Myofascial Release is and how it helps with pain and tension?,"Myofascial Release is a specialized treatment that involves gentle, sustained pressure. It focuses on addressing soft tissue dysfunction, pain, and tension by releasing restrictions in the fascia, the connective tissue surrounding muscles and organs."
What is the difference between the Luxury Holistic Facial and the Red Light Therapy Facial Massage?,"The Luxury Holistic Facial is a comprehensive treatment including a double cleanse, exfoliate, steam, facial massage, mask, tone, and moisturize using natural skincare products, aiming for radiant youthful skin. The Red Light Therapy Facial Massage is a distinct luxury facial treatment also for radiant youthful skin, but specifically incorporates red light therapy."
"What is the concept behind Reiki, and what happens during a session?","The word 'Reiki' means universal energy. During a Reiki session, the therapist channels this universal energy through their hands, promoting healing for the client."
What conditions can Hopi Ear Candling help to alleviate?,"Hopi Ear Candling is a calming process that can help to alleviate headaches, improve tinnitus, ease sinus congestion, soften ear wax, and promote overall wellness."
How does Reflexology work according to its underlying theory?,"Reflexology is based on the theory that the organs and structures of the body are connected and mapped to the feet. By applying pressure to specific points on the feet, it is believed to positively influence corresponding body parts."
"I'm looking for a quick, affordable treatment. What 30-minute options are available, and what do they cost?","The Sunday Therapist offers several 30-minute treatments: Myofascial Release (30 mins) for £30, Back, Neck & Shoulder (BNS) Massage (30 mins) for £30, Head Massage for £30, and Reflexology (30 mins) for £27."
"Is it possible to combine different 30-minute treatments, and are there any savings for doing so?","Yes, The Sunday Therapist offers a 'Mix and Match' option where you can combine any two 30-minute treatments for £45, which can result in a saving of up to £15 compared to booking them individually."
"What is included in the Luxury Foot Soak, Foot Scrub, Foot Massage with 30-Minute Reflexology Treatment, and what is its price?","This comprehensive foot treatment includes a luxury foot soak, foot scrub, foot massage, and a 30-minute Reflexology treatment, all for a price of £45."
Do you offer gift vouchers for your therapies?,"Yes, The Sunday Therapist offers gift vouchers, which are described as a perfect gift for a loved one to spoil them."
What are the specific opening hours for appointments on a Sunday?,"On Sundays, The Sunday Therapist is open from 10am to 5pm."
What is the best way to get in touch with The Sunday Therapist to book an appointment or make an inquiry?,"You can get in touch by telephone at 07763452823, via email at thesundaytherapist@outlook.com, or through their Facebook page @therapyonsunday."
What is the significance of The Sunday Therapist's commitment to using vegan and cruelty-free products?,"The Sunday Therapist is committed to using vegan and cruelty-free products in their therapies. This signifies an ethical approach to wellness, ensuring that no animal products are used and no animals are harmed in the making or testing of the products."
How does The Sunday Therapist ensure that therapies are 'tailored for individual needs'?,"The Sunday Therapist emphasizes tailoring therapies for individual needs, indicating a personalized approach where treatments are adapted to suit each client's specific requirements and wellness goals, rather than a one-size-fits-all method."
What is the primary difference in technique and pressure between a Swedish Massage and a Deep Tissue Massage?,"A Swedish Massage uses gentle, long gliding strokes to relax muscles, improve circulation, and relieve tension. In contrast, Deep Tissue Massage harnesses focused techniques with firm pressure to reach the deeper layers of the muscles, addressing more profound tension and muscle issues."
I frequently suffer from headaches. Which therapy would you recommend for relief?,"For headache relief, the Head Massage is specifically mentioned as a beneficial treatment. It involves gentle massage to the neck, face, and scalp, and its benefits include stress reduction and relief from headaches."
"When did Joanne begin her training in holistic therapies, and when did she decide to make it her full-time career?",Joanne started training in holistic therapies in 2019. She decided to leave the NHS after 24 years of service in 2025 to focus on holistic therapies as her full-time career.
What is the full physical address of The Sunday Therapist?,"The full address for The Sunday Therapist is 462a Walmersley Road, Bury, BL9 6QP."
"What kind of third-party tracking technologies does The Sunday Therapist's website use, and how can I manage my consent for them?","The website uses third-party website tracking technologies for services like Website Translator and IONOS SiteAnalytics to continually improve services and display advertisements. Users can review details in the privacy policy and accept the service to view translations, and also configure privacy settings to select and deactivate various tags/trackers/analytic tools at any time."
What are the specific benefits of a Wood Massage treatment?,Wood Massage is known for its ability to sculpt and tone the body while boosting overall wellness.
Is there a way to combine multiple shorter treatments for a reduced price?,"Yes, The Sunday Therapist offers a 'Mix and Match' option where you can combine any two 30-minute treatments for £45, potentially saving up to £15."
"How long has Joanne, The Sunday Therapist, been practicing holistic therapies professionally?",Joanne started training in holistic therapies in 2019 and decided to leave the NHS in 2025 to focus on this as a full-time career.
What kind of products are used during the treatments at The Sunday Therapist?,The Sunday Therapist is committed to using vegan and cruelty-free products for all treatments.
What is the primary aim of Myofascial Release therapy?,"Myofascial Release is a specialized treatment that involves gentle sustained pressure, focusing on soft tissue dysfunction, pain, and tension."
What does the Luxury Holistic Facial treatment include?,"The Luxury Holistic Facial treatment includes a double cleanse, exfoliate, steam, facial massage, mask, tone, and moisturize using natural skincare products."
How much does a 60-minute Reflexology session cost?,A 60-minute Reflexology session costs £42.
Which therapy is specifically designed to target symptoms associated with menstruation and menopause?,The Menopause Massage is a Swedish massage with acupressure specifically targeting symptoms associated with menstruation and menopause.
"What professional body is The Sunday Therapist registered with, and what does this registration signify?","The Sunday Therapist is registered with the Federation of Holistic Therapists (FHT), which is a professional body ensuring high standards in both training and practice."
What is the best way to get in touch to book an appointment or inquire about services?,"You can get in touch by telephone at 07763 452 823, email at thesundaytherapist@outlook.com, or through their Facebook page @therapyonsunday. The address is 462a Walmersley Road, Bury, BL9 6QP."
Is The Sunday Therapist located within a larger complex or is it a standalone clinic at 462a Walmersley Road?,"The web content provides the specific address as 462a Walmersley Road, Bury, BL9 6QP, indicating it is the direct location for The Sunday Therapist."
Can Hopi Ear Candling help with sinus congestion or headaches?,"Yes, Hopi Ear Candling is a calming process that can help to alleviate headaches and ease sinus congestion, among other benefits."
What's the key difference between a Swedish Massage and a Deep Tissue Massage?,"Swedish Massage uses gentle, long gliding strokes to relax muscles and improve circulation, while Deep Tissue Massage uses firm pressure and focused techniques to reach deeper layers of the muscles."
"When did Joanne decide to fully commit to holistic therapy as her career, and what was her previous profession?",Joanne decided to leave the NHS in 2025 after 24 years of service to focus on holistic therapy as a career.
"How much does a 30-minute Back, Neck & Shoulder (BNS) Massage cost?","A 30-minute Back, Neck & Shoulder (BNS) Massage costs £30."
Are gift vouchers available for purchase?,"Yes, gift vouchers are available for purchase, described as a perfect gift for a loved one."
"What does 'treating the whole person, body, mind and spirit' mean in the context of The Sunday Therapist's approach?","Treating the whole person, body, mind, and spirit is The Sunday Therapist's holistic approach, which Joanne has seen first-hand provides benefits such as reduced stress and anxiety, enhanced immune function, alleviation of pain, and overall improvement in long-term wellbeing."
What is the Red Light Therapy Facial Massage primarily aimed at achieving for the skin?,The Red Light Therapy Facial Massage is a luxury facial treatment designed for radiant youthful skin.
What is the meaning behind the name 'Reiki' and how does the therapy work?,"The word Reiki means universal energy. During a session, the therapist channels this universal energy through their hands to promote healing."
"What is included in the Luxury Foot Soak, Foot Scrub, Foot Massage with 30-Minute Reflexology Treatment, and what is its price?","This treatment includes a Luxury Foot Soak, Foot Scrub, Foot Massage, and a 30-Minute Reflexology Treatment, all for £45."
What is the latest time I can book an appointment on a Monday or Tuesday?,"On Mondays and Tuesdays, The Sunday Therapist is open until 7pm, so appointments would be scheduled to finish by then."
"Beyond relaxation, what other long-term benefits can be expected from holistic therapy according to Joanne?","According to Joanne, holistic therapy can result in reduced stress and anxiety, enhanced immune function, alleviation of pain, and overall improvement in long-term wellbeing."
Which specific therapy helps with boosting the immune system and reducing water retention?,"Manual Lymphatic Drainage is a specialized treatment whose benefits include boosting the immune system and reducing water retention, as well as enhancing detoxification."
What is the Facebook handle for The Sunday Therapist?,The Facebook handle for The Sunday Therapist is @therapyonsunday.
How can I manage my consent for website tracking technologies used on The Sunday Therapist's website?,"You can manage your consent for website tracking technologies by clicking on the 'Configure Website Translator IONOS SiteAnalytics Privacy Settings' link, which allows you to select and deactivate various tags/trackers/analytic tools."
What inspired Joanne to transition from a 24-year career in the NHS to focus entirely on holistic therapies?,"Joanne's passion for holistic therapies grew significantly after starting her training in 2019 while still working for the NHS. She witnessed firsthand the profound benefits of treating the whole person – body, mind, and spirit – leading her to leave the NHS in 2025 to pursue holistic therapy as a full-time career."
"Could you elaborate on what 'treating the whole person, body, mind and spirit' entails in practice at The Sunday Therapist?","Treating the whole person means that The Sunday Therapist addresses not just physical symptoms but also the mental and spiritual aspects of a client's well-being. This holistic approach aims to provide benefits such as reduced stress and anxiety, enhanced immune function, alleviation of pain, and overall improvement in long-term well-being, by considering the interconnectedness of these elements."
